{
  "task_name": "extract_credential_access",
  "goal": "Extract candidate credential access activity from security logs.",
  "target_event_types": ["credential_access"],
  "required_fields": [
    "timestamp",
    "host",
    "user",
    "event_id",
    "event_type",
    "process_name",
    "process_path",
    "command_line",
    "parent_process_name",
    "parent_command_line",
    "process_id",
    "parent_process_id",
    "source_ip",
    "dest_ip",
    "dest_port",
    "raw_message",
    "source_line"
  ],
  "output_format": "jsonl"
}

